{
  "schema_version": 1,
  "current_phase": 5,
  "invariants_version": 2,
  "phases": {
    "0": {
      "status": "done",
      "plan": "docs/phases/phase-0-plan.md",
      "plan_approved": true,
      "plan_approved_by": "standing approval: Ramin, 2026-10-19 (\"proceed to the next phase without waiting for my permission\")",
      "report": "docs/phases/phase-0-report.md",
      "gate_job": "gate-p0",
      "gate_run_url": null,
      "done_commit": "e57b791878396338f12158b6737df4950e1ba491",
      "done_at": "2026-10-20T01:04:33Z",
      "adrs": [
        "0001-modular-monolith-and-module-boundaries",
        "0002-stock-balances-table-vs-materialized-view",
        "0003-idempotency-and-client-uuid",
        "0004-numeric-as-string-end-to-end",
        "0005-phase-gates-and-ci"
      ],
      "adr_waiver": null,
      "contracts_required": [
        "inventory->catalog",
        "catalog->identity"
      ],
      "modules": {
        "repo": "done",
        "shared": "done",
        "audit": "done",
        "identity": "done",
        "catalog": "done",
        "inventory": "done",
        "web": "done",
        "seeds": "done",
        "docs": "done"
      },
      "playwright_projects": [
        "p0-admin-smoke"
      ]
    },
    "1": {
      "status": "done",
      "plan": "docs/phases/phase-1-plan.md",
      "plan_approved": true,
      "plan_approved_by": "standing approval: Ramin, 2026-10-19",
      "report": "docs/phases/phase-1-report.md",
      "gate_job": "gate-p1",
      "gate_run_url": "https://github.com/obssa/bakery-ops/actions/runs/39518339551",
      "done_commit": "d0f62a56f94eb8d03c1c7b07d5a9c35082608987",
      "done_at": "2026-10-21T00:18:37Z",
      "adrs": [
        "0008-reserve-at-send-consume-at-ready-sale-at-pay",
        "0009-live-updates-polling-first"
      ],
      "adr_waiver": null,
      "contracts_required": [
        "orders->inventory",
        "orders->catalog",
        "orders->identity",
        "payments->orders"
      ],
      "modules": {
        "contracts": "done",
        "shared.broadcast": "done",
        "orders": "done",
        "payments": "done",
        "read-models": "done",
        "web": "done",
        "docs": "done"
      },
      "playwright_projects": [
        "p1-order-flow",
        "p1-shortfall"
      ]
    },
    "2": {
      "status": "done",
      "plan": "docs/phases/phase-2-plan.md",
      "plan_approved": true,
      "plan_approved_by": "standing approval: Ramin, 2026-10-19",
      "report": "docs/phases/phase-2-report.md",
      "gate_job": "gate-p2",
      "gate_run_url": "https://github.com/obssa/bakery-ops/actions/runs/39721616830",
      "done_commit": "b981f3758241145afb2d483745538d6aa0944dcb",
      "done_at": "2026-10-22T04:44:19Z",
      "adrs": [
        "0010-station-presence-resolver",
        "0011-stock-alert-dedupe-and-queued-actor"
      ],
      "adr_waiver": null,
      "contracts_required": [
        "production->inventory",
        "production->catalog",
        "production->identity",
        "notifications->identity"
      ],
      "modules": {
        "contracts": "done",
        "inventory.purchases": "done",
        "inventory.transfers": "done",
        "catalog.recipe-versions": "done",
        "notifications": "done",
        "inventory.reorder": "done",
        "production": "done",
        "web": "done",
        "docs": "done"
      },
      "playwright_projects": [
        "p2-stockout-production",
        "p2-purchase-transfer"
      ]
    },
    "3": {
      "status": "done",
      "plan": "docs/phases/phase-3-plan.md",
      "plan_approved": true,
      "plan_approved_by": "standing approval: Ramin, 2026-10-19",
      "report": "docs/phases/phase-3-report.md",
      "gate_job": "gate-p3",
      "gate_run_url": "https://github.com/obssa/bakery-ops/actions/runs/40073782837",
      "done_commit": "3b37a697ad3e26b8547eafdda55837670dda6044",
      "done_at": "2026-10-24T08:19:03Z",
      "adrs": [
        "0012-hash-chain-canonical-json",
        "0013-shift-attribution-rules"
      ],
      "adr_waiver": null,
      "contracts_required": [
        "shifts->inventory",
        "shifts->identity",
        "shifts->payments",
        "shifts->orders"
      ],
      "modules": {
        "contracts": "done",
        "shifts.instances": "done",
        "shifts.counts": "done",
        "shifts.locks": "done",
        "shifts.cash": "done",
        "shifts.handover": "done",
        "web": "done",
        "docs": "done",
        "shifts": "done"
      },
      "playwright_projects": [
        "p3-handover",
        "p3-opening-prefill"
      ]
    },
    "4": {
      "status": "done",
      "plan": "docs/phases/phase-4-plan.md",
      "plan_approved": true,
      "plan_approved_by": "standing approval: Ramin, 2026-10-19",
      "report": "docs/phases/phase-4-report.md",
      "gate_job": "gate-p4",
      "gate_run_url": "https://github.com/obssa/bakery-ops/actions/runs/40821698063",
      "done_commit": "b7b58e9710f14d9db5c4ca365231f666ae263d34",
      "done_at": "2026-10-29T06:48:39Z",
      "adrs": [
        "0014-summary-rebuild-semantics",
        "0015-file-storage-portability",
        "0016-refunds-voids-and-the-cash-drawer"
      ],
      "adr_waiver": null,
      "contracts_required": [
        "payments->orders",
        "analytics->facts"
      ],
      "modules": {
        "contracts": "done",
        "shared.files": "done",
        "payments": "done",
        "analytics": "done",
        "web": "done",
        "docs": "done"
      },
      "playwright_projects": [
        "p4-pay-photo-split",
        "p4-dashboards"
      ]
    },
    "5": {
      "status": "in_progress",
      "plan": "docs/phases/phase-5-plan.md",
      "plan_approved": true,
      "plan_approved_by": "standing approval: Ramin, 2026-10-19",
      "report": null,
      "gate_job": "gate-p5",
      "gate_run_url": null,
      "done_commit": null,
      "done_at": null,
      "adrs": [],
      "adr_waiver": null,
      "contracts_required": [],
      "modules": {
        "identity.devices": "in_progress",
        "web.offline": "todo",
        "print-bridge": "todo",
        "i18n": "todo",
        "ops": "in_progress",
        "docs": "todo"
      },
      "playwright_projects": [
        "p5-device",
        "p5-offline"
      ]
    }
  },
  "modules": {
    "shared": {
      "phase": 0,
      "status": "stable",
      "stable_since": "2026-10-19T09:57:39Z"
    },
    "audit": {
      "phase": 0,
      "status": "stable",
      "stable_since": "2026-10-19T10:51:34Z"
    },
    "identity": {
      "phase": 0,
      "status": "stable",
      "stable_since": "2026-10-19T15:17:57Z"
    },
    "catalog": {
      "phase": 0,
      "status": "stable",
      "stable_since": "2026-10-19T16:55:28Z"
    },
    "inventory": {
      "phase": 0,
      "status": "stable",
      "stable_since": "2026-10-19T22:10:10Z"
    },
    "orders": {
      "phase": 1,
      "status": "stable",
      "stable_since": "2026-10-20T15:43:50Z"
    },
    "payments": {
      "phase": 1,
      "status": "stable",
      "stable_since": "2026-10-28T21:14:22Z"
    },
    "notifications": {
      "phase": 2,
      "status": "stable",
      "stable_since": "2026-10-21T12:35:19Z"
    },
    "production": {
      "phase": 2,
      "status": "stable",
      "stable_since": "2026-10-21T21:44:45Z"
    },
    "shifts": {
      "phase": 3,
      "status": "stable",
      "stable_since": "2026-10-23T05:30:01Z"
    },
    "analytics": {
      "phase": 4,
      "status": "stable",
      "stable_since": "2026-10-26T22:42:42Z"
    }
  }
}
